Warning: No platform specified. Output may be incomplete
File /home/raspberry/original_dump.bin is 16777216 bytes
ICH Revision: Unknown PCH
FLMAP0:    0x00040003
  NR:      0
  FRBA:    0x40
  NC:      1
  FCBA:    0x30
FLMAP1:    0x42100208
  ISL:     0x42
  FPSBA:   0x100
  NM:      2
  FMBA:    0x80
FLMAP2:    0x00310330
  PSL:     0x3103
  FMSBA:   0x300
FLUMAP1:   0x000008df
  Intel ME VSCC Table Length (VTL):        8
  Intel ME VSCC Table Base Address (VTBA): 0x000df0

ME VSCC table:
  JID0:  0x001820c2
    SPI Component Vendor ID:            0xc2
    SPI Component Device ID 0:          0x20
    SPI Component Device ID 1:          0x18
  VSCC0: 0x20452045
    Lower Erase Opcode:                 0x20
    Lower Write Enable on Write Status: 0x50
    Lower Write Status Required:        No
    Lower Write Granularity:            64 bytes
    Lower Block / Sector Erase Size:    4KB
    Upper Erase Opcode:                 0x20
    Upper Write Enable on Write Status: 0x50
    Upper Write Status Required:        No
    Upper Write Granularity:            64 bytes
    Upper Block / Sector Erase Size:    4KB
  JID1:  0x001840ef
    SPI Component Vendor ID:            0xef
    SPI Component Device ID 0:          0x40
    SPI Component Device ID 1:          0x18
  VSCC1: 0x20252025
    Lower Erase Opcode:                 0x20
    Lower Write Enable on Write Status: 0x50
    Lower Write Status Required:        No
    Lower Write Granularity:            64 bytes
    Lower Block / Sector Erase Size:    4KB
    Upper Erase Opcode:                 0x20
    Upper Write Enable on Write Status: 0x50
    Upper Write Status Required:        No
    Upper Write Granularity:            64 bytes
    Upper Block / Sector Erase Size:    4KB
  JID2:  0x0018ba20
    SPI Component Vendor ID:            0x20
    SPI Component Device ID 0:          0xba
    SPI Component Device ID 1:          0x18
  VSCC2: 0x20052005
    Lower Erase Opcode:                 0x20
    Lower Write Enable on Write Status: 0x50
    Lower Write Status Required:        No
    Lower Write Granularity:            64 bytes
    Lower Block / Sector Erase Size:    4KB
    Upper Erase Opcode:                 0x20
    Upper Write Enable on Write Status: 0x50
    Upper Write Status Required:        No
    Upper Write Granularity:            64 bytes
    Upper Block / Sector Erase Size:    4KB
  JID3:  0x0018701c
    SPI Component Vendor ID:            0x1c
    SPI Component Device ID 0:          0x70
    SPI Component Device ID 1:          0x18
  VSCC3: 0x20052005
    Lower Erase Opcode:                 0x20
    Lower Write Enable on Write Status: 0x50
    Lower Write Status Required:        No
    Lower Write Granularity:            64 bytes
    Lower Block / Sector Erase Size:    4KB
    Upper Erase Opcode:                 0x20
    Upper Write Enable on Write Status: 0x50
    Upper Write Status Required:        No
    Upper Write Granularity:            64 bytes
    Upper Block / Sector Erase Size:    4KB

OEM Section:
00: 52 30 36 4d 42 32 31 57 ff 31 31 2e 30 2e 31 32
10: 2e 31 30 30 38 ff 31 36 4d 42 ff 53 49 47 4e 45
20: 44 ff 51 53 ff ff ff ff ff ff ff ff ff ff ff ff
30: ff ff ff ff ff ff ff ff ff ff ff ff ff ff ff ff

Found Region Section
FLREG0:    0x00000000
  Flash Region 0 (Flash Descriptor): 00000000 - 00000fff 
FLREG1:    0x0fff0700
  Flash Region 1 (BIOS): 00700000 - 00ffffff 
FLREG2:    0x06ff0003
  Flash Region 2 (Intel ME): 00003000 - 006fffff 
FLREG3:    0x00020001
  Flash Region 3 (GbE): 00001000 - 00002fff 
FLREG4:    0x00007fff
  Flash Region 4 (Platform Data): 00fff000 - 00000fff (unused)

Found Component Section
FLCOMP     0x325c00f5
  Dual Output Fast Read Support:       not supported
  Read ID/Read Status Clock Frequency: 17MHz
  Write/Erase Clock Frequency:         48MHz
  Fast Read Clock Frequency:           48MHz
  Fast Read Support:                   supported
  Read Clock Frequency:                17MHz
  Component 2 Density:                 32MB
  Component 1 Density:                 16MB
FLILL      0xad604221
  Invalid Instruction 3: 0xad
  Invalid Instruction 2: 0x60
  Invalid Instruction 1: 0x42
  Invalid Instruction 0: 0x21
FLPB       0xc7c4b9b7
  Flash Partition Boundary Address: 0x9b7000

Found PCH Strap Section
PCHSTRP0  : 0x00100000
PCHSTRP1  : 0x00000100
PCHSTRP2  : 0x00000000
PCHSTRP3  : 0x00000000
PCHSTRP4  : 0x00000000
PCHSTRP5  : 0x00010000
PCHSTRP6  : 0x00000100
PCHSTRP7  : 0x00000000
PCHSTRP8  : 0x00000000
PCHSTRP9  : 0x00000000
PCHSTRP10 : 0x00030000
PCHSTRP11 : 0x4c970100
PCHSTRP12 : 0x00010000
PCHSTRP13 : 0x00000000
PCHSTRP14 : 0x00000000
PCHSTRP15 : 0x00010000
PCHSTRP16 : 0x00000000
PCHSTRP17 : 0x01000070
PCHSTRP18 : 0x00000203
PCHSTRP19 : 0x00000064
PCHSTRP20 : 0x00000000
PCHSTRP21 : 0x00003a19
PCHSTRP22 : 0x00000002
PCHSTRP23 : 0x00000008
PCHSTRP24 : 0x00000030
PCHSTRP25 : 0x00000040
PCHSTRP26 : 0x0000001d
PCHSTRP27 : 0x00010000
PCHSTRP28 : 0x00000000
PCHSTRP29 : 0x0000000e
PCHSTRP30 : 0x00000001
PCHSTRP31 : 0x00001d4c
PCHSTRP32 : 0x00010001
PCHSTRP33 : 0x00000000
PCHSTRP34 : 0x00000000
PCHSTRP35 : 0x0000055d
PCHSTRP36 : 0xff0af091
PCHSTRP37 : 0xfcfcfcf7
PCHSTRP38 : 0x00000000
PCHSTRP39 : 0x00000000
PCHSTRP40 : 0x00000000
PCHSTRP41 : 0x00000c00
PCHSTRP42 : 0x00000000
PCHSTRP43 : 0x00001800
PCHSTRP44 : 0x00000000
PCHSTRP45 : 0x00000047
PCHSTRP46 : 0x00000012
PCHSTRP47 : 0x0010033f
PCHSTRP48 : 0x00000080
PCHSTRP49 : 0x00000013
PCHSTRP50 : 0x02640000
PCHSTRP51 : 0x00000000
PCHSTRP52 : 0x0961f400
PCHSTRP53 : 0x00000019
PCHSTRP54 : 0x55555579
PCHSTRP55 : 0x0000011f
PCHSTRP56 : 0x0a010703
PCHSTRP57 : 0x00000200
PCHSTRP58 : 0x020f0009
PCHSTRP59 : 0x00ff0000
PCHSTRP60 : 0x00000005
PCHSTRP61 : 0x00008645
PCHSTRP62 : 0x00000000
PCHSTRP63 : 0x00000e20
PCHSTRP64 : 0x00000000
PCHSTRP65 : 0x000433f4
AltMeDisable bit is not set

Found Master Section
FLMSTR1:   0x00a00b00 (Host CPU/BIOS)
  Platform Data Region Write Access: disabled
  GbE Region Write Access:           disabled
  Intel ME Region Write Access:      disabled
  Host CPU/BIOS Region Write Access: disabled
  Flash Descriptor Write Access:     disabled
  Platform Data Region Read Access:  disabled
  GbE Region Read Access:            disabled
  Intel ME Region Read Access:       disabled
  Host CPU/BIOS Region Read Access:  disabled
  Flash Descriptor Read Access:      disabled
  Requester ID:                      0x0b00

FLMSTR2:   0x00c00d00 (Intel ME)
  Platform Data Region Write Access: disabled
  GbE Region Write Access:           disabled
  Intel ME Region Write Access:      disabled
  Host CPU/BIOS Region Write Access: disabled
  Flash Descriptor Write Access:     disabled
  Platform Data Region Read Access:  disabled
  GbE Region Read Access:            disabled
  Intel ME Region Read Access:       disabled
  Host CPU/BIOS Region Read Access:  disabled
  Flash Descriptor Read Access:      disabled
  Requester ID:                      0x0d00

FLMSTR3:   0x00800800 (GbE)
  Platform Data Region Write Access: disabled
  GbE Region Write Access:           disabled
  Intel ME Region Write Access:      disabled
  Host CPU/BIOS Region Write Access: disabled
  Flash Descriptor Write Access:     disabled
  Platform Data Region Read Access:  disabled
  GbE Region Read Access:            disabled
  Intel ME Region Read Access:       disabled
  Host CPU/BIOS Region Read Access:  disabled
  Flash Descriptor Read Access:      disabled
  Requester ID:                      0x0800

Found Processor Strap Section
????:      0x00001000
????:      0x00118002
????:      0x00000210
????:      0xffffffff
????:      0xffffffff
????:      0xffffffff
????:      0xffffffff
????:      0xffffffff
